{
  "version": "1.0.0",
  "generated_at": "2026-03-16T00:00:00+00:00",
  "source_sheet_id": "",
  "confidence": 0.0,
  "notes": "Draft rules placeholder. Run --compile-rules to generate.",
  "column_map": {},
  "value_maps": {
    "platform": {
      "leetcode": "Leetcode",
      "codeforces": "Codeforces Contest",
      "atcoder": "Atcoder"
    }
  },
  "normalizers": {
    "platform_case": "sheet-value",
    "date_format": "YYYY-MM-DD"
  }
}